{
  "fixture_id": "baby-eval-chinese-gender-behavior",
  "schema_version": "name-evaluation-fixture-v1",
  "vertical": "baby",
  "title": "Chinese cultural context with correct gender behavior",
  "description": "Chinese-rooted girl names that honor the requested gender direction and explain cultural context carefully.",
  "intake": {"gender": "Girl", "cultural_heritage": "Chinese", "cultural_context": "Family heritage", "family_context": "Chinese heritage; name should work in the United States", "style": "Elegant", "familiarity_preference": "A little less common", "timeless_vs_distinctive": "Balanced", "sound": "Soft", "discovery_style": "Balanced mix"},
  "expected_naming_territories": ["Chinese", "elegant", "soft"],
  "desired_qualities": ["correct gender", "culturally grounded", "US usability"],
  "prohibited_qualities": ["boy-only candidate", "unsupported meaning"],
  "reference_candidates": ["Mei", "Lian", "Jia"],
  "rejection_candidates": ["Wei", "Jian"],
  "acceptance_criteria": {"minimum_normalized_score": 0.75, "criteria": [
    {"criterion": "required_candidate_count", "weight": 1, "parameters": {"minimum": 6}},
    {"criterion": "duplicate_prevention", "weight": 1},
    {"criterion": "prohibited_names", "weight": 1},
    {"criterion": "cultural_relevance", "weight": 2, "parameters": {"minimum": 0.55}},
    {"criterion": "gender_fit", "weight": 2, "parameters": {"minimum_ratio": 1}},
    {"criterion": "style_fit", "weight": 1, "parameters": {"minimum": 0.55}},
    {"criterion": "explanation_completeness", "weight": 1},
    {"criterion": "metadata_completeness", "weight": 1},
    {"criterion": "valid_bounded_scores", "weight": 1},
    {"criterion": "privacy_safety", "weight": 1}
  ]},
  "regression_notes": "This fixture explicitly guards against cross-gender fallback leakage.",
  "tags": ["baby", "heritage", "chinese", "gender-fit"],
  "enabled": true
}
