{
  "fixture_id": "baby-eval-african-american-historical",
  "schema_version": "name-evaluation-fixture-v1",
  "vertical": "baby",
  "title": "African American heritage and historical relevance",
  "description": "A culturally grounded boy list with meaningful historical or literary relevance.",
  "intake": {"gender": "Boy", "cultural_heritage": "African American", "cultural_context": "Family heritage", "style": "Strong and tailored", "familiarity_preference": "Recognizable but not overused", "timeless_vs_distinctive": "Mostly distinctive", "sound": "Strong", "discovery_style": "Rare but wearable", "notes": "Prioritize strong historical or literary relevance in African American culture."},
  "expected_naming_territories": ["historical", "literary", "heritage"],
  "desired_qualities": ["culturally grounded", "strong", "respectful"],
  "prohibited_qualities": ["generic style-only rationale", "unsupported cultural claim"],
  "reference_candidates": ["Langston", "Booker", "Ellington"],
  "rejection_candidates": [],
  "acceptance_criteria": {"minimum_normalized_score": 0.7, "criteria": [
    {"criterion": "required_candidate_count", "weight": 1, "parameters": {"minimum": 8}},
    {"criterion": "duplicate_prevention", "weight": 1},
    {"criterion": "cultural_relevance", "weight": 2, "parameters": {"minimum": 0.55}},
    {"criterion": "gender_fit", "weight": 1},
    {"criterion": "style_fit", "weight": 1, "parameters": {"minimum": 0.55}},
    {"criterion": "territory_coverage", "weight": 1, "required": false, "parameters": {"minimum_ratio": 0.33}},
    {"criterion": "explanation_completeness", "weight": 1},
    {"criterion": "metadata_completeness", "weight": 1},
    {"criterion": "valid_bounded_scores", "weight": 1},
    {"criterion": "privacy_safety", "weight": 1}
  ]},
  "regression_notes": "Reference candidates illustrate territory only; explanations must substantiate cultural fit.",
  "tags": ["baby", "heritage", "african-american", "historical"],
  "enabled": true
}
