{
  "fixture_id": "baby-eval-honor-name-influence",
  "schema_version": "name-evaluation-fixture-v1",
  "vertical": "baby",
  "title": "Honor-name influence without exact copying",
  "description": "The list should echo an honor name through sound, initial, meaning, or style without requiring the exact name.",
  "intake": {"gender": "Girl", "family_context": "Honor grandmother Margaret without requiring Margaret itself", "cultural_heritage": "No preference", "cultural_context": "Honor names", "partner_alignment": "We like the M initial and classic strength but want something fresher", "style": "Classic", "familiarity_preference": "Recognizable but not overused", "timeless_vs_distinctive": "Mostly timeless", "sound": "Warm", "discovery_style": "Rare but wearable", "avoid": "Margaret"},
  "expected_naming_territories": ["honor", "classic", "M initial"],
  "desired_qualities": ["family connection", "fresh", "warm"],
  "prohibited_qualities": ["exact copying only", "unexplained connection"],
  "reference_candidates": ["Margot", "Mara", "Greta"],
  "rejection_candidates": ["Margaret"],
  "acceptance_criteria": {"minimum_normalized_score": 0.68, "criteria": [
    {"criterion": "required_candidate_count", "weight": 1, "parameters": {"minimum": 8}},
    {"criterion": "duplicate_prevention", "weight": 1},
    {"criterion": "prohibited_names", "weight": 1},
    {"criterion": "gender_fit", "weight": 1},
    {"criterion": "style_fit", "weight": 1, "parameters": {"minimum": 0.55}},
    {"criterion": "territory_coverage", "weight": 1, "required": false, "parameters": {"minimum_ratio": 0.33}},
    {"criterion": "explanation_completeness", "weight": 1},
    {"criterion": "metadata_completeness", "weight": 1},
    {"criterion": "valid_bounded_scores", "weight": 1},
    {"criterion": "privacy_safety", "weight": 1}
  ]},
  "regression_notes": "A good result may use initials, cognates, sound echoes, meanings, or stylistic lineage.",
  "tags": ["baby", "honor-name", "family", "classic"],
  "enabled": true
}
